{"schema_version":"unirouter.source-evidence-scope-receipt.v1","product":"unirouter","campaign_id":"source-evidence-conformance-20300101","status":"accepted","source_binding_sha256":"sha256:c8959a370ae9955df2d732897a9ed24ffff0a2b1d03844dd9ff3dbb8607f9020","request_set_sha256":"sha256:72eb7c2d4816be53d4f43c22696fe68becaaceb568524d333b403f4655d7940f","release_identity_sha256":"sha256:0b28c140c3a2835480896cf4d64e726300ef67d4a7cf779138e2fca032d23f35","protocol_pin_sha256":"sha256:4444444444444444444444444444444444444444444444444444444444444444","source_instance":"unirouter-conformance-source","identity_authority":"neutral_campaign_authorization","runtime_observation":"not_claimed","request_count":1,"max_requests":20,"max_facts":200,"observed_at":"2029-12-31T23:59:00Z","database_isolation":"repeatable read","database_read_only":true,"transaction_id_assigned":false,"effects":{"database_mutation":"none","additional_gateway_calls":0,"provider_calls":0,"feed_calls":0,"upstream_calls":0}}